{
  "$schema": "./schemas/restore-fleet.schema.json",

  "version": 1,
  "anchor": "phi^2 + phi^-2 = 3",

  "project": {
    "name": "IGLA",
    "description": "IGLA RACE training fleet — restored after a Railway-account ban or project loss. Anchor: phi^2 + phi^-2 = 3.",
    "default_environment": "production"
  },

  "image": "ghcr.io/ghashtag/trios-trainer-igla:latest",

  "shared_vars": [
    { "key": "RUST_LOG",                "value": "info" },
    { "key": "TRIOS_HIDDEN",            "value": "384" },
    { "key": "TRIOS_LR",                "value": "0.003" },
    { "key": "TRIOS_OPTIMIZER",         "value": "adamw" },
    { "key": "TRIOS_STEPS",             "value": "60000" },
    { "key": "TRIOS_ATTN_LAYERS",       "value": "2" },
    { "key": "L_R8_SYNTHETIC_FALLBACK", "value": "FORBID" },
    { "key": "RAILWAY_POSTGRES_URL",    "value": "${secret:RAILWAY_POSTGRES_URL}" },
    { "key": "NEON_DATABASE_URL",       "value": "${secret:NEON_DATABASE_URL}" }
  ],

  "services": [
    {
      "name": "trios-mcp-public",
      "kind": "mcp",
      "image_override": "ghcr.io/ghashtag/trios-railway-mcp:latest",
      "vars": [
        { "key": "RAILWAY_TOKEN",      "value": "${secret:RAILWAY_TOKEN}" },
        { "key": "RAILWAY_TOKEN_AUTH", "value": "team" },
        { "key": "PORT",               "value": "8080" }
      ]
    },

    {
      "name": "igla-final-seed-42",
      "kind": "trainer",
      "vars": [
        { "key": "TRIOS_SEED",  "value": "42" },
        { "key": "TRIOS_LANE",  "value": "A-champion-fineweb" }
      ]
    },
    {
      "name": "igla-final-seed-43",
      "kind": "trainer",
      "vars": [
        { "key": "TRIOS_SEED",  "value": "43" },
        { "key": "TRIOS_LANE",  "value": "A-champion-fineweb" }
      ]
    },
    {
      "name": "igla-final-seed-44",
      "kind": "trainer",
      "vars": [
        { "key": "TRIOS_SEED",  "value": "44" },
        { "key": "TRIOS_LANE",  "value": "A-champion-fineweb" }
      ]
    },

    {
      "name": "trios-train-seed-100",
      "kind": "trainer",
      "vars": [
        { "key": "TRIOS_SEED",  "value": "100" },
        { "key": "TRIOS_LANE",  "value": "B-mirror2" }
      ]
    },
    {
      "name": "trios-train-seed-101",
      "kind": "trainer",
      "vars": [
        { "key": "TRIOS_SEED",  "value": "101" },
        { "key": "TRIOS_LANE",  "value": "B-mirror2" }
      ]
    },
    {
      "name": "trios-train-seed-102",
      "kind": "trainer",
      "vars": [
        { "key": "TRIOS_SEED",  "value": "102" },
        { "key": "TRIOS_LANE",  "value": "B-mirror2" }
      ]
    },

    {
      "name": "trios-dwagent",
      "kind": "agent",
      "vars": [
        { "key": "RAILWAY_TOKEN", "value": "${secret:RAILWAY_TOKEN}" }
      ]
    }
  ],

  "post_restore": {
    "neon_ddl":         "tri-railway audit migrate-sql",
    "embargo_check":    "trios-igla check ${champion_sha}",
    "experience_line":  "RAIL=restore @ project=${project_uuid_8c} service=ALL sha=${git_sha_8c} ts=${rfc3339}"
  }
}
